narration_id,narration_text
4,"In this room there is a floating bed with a man sitting on it, a small reading desk with a black chair, the desk as a remote and other items like a small plant. The curtains are seen through, some of them are open letting in light. There is a small side shelf floating next to the bed. A man wearing a plaid shirt and blue jeans has his legs crossed and is lying on his back on the head of the bed . The man is using his phone and he puts his phone next to the side shelf, he takes a few steps out of his bed and grabs a remote. He turns the TV on standing and sits back down on the bed. The TV is small and mounted across the bed."
5,"This scene shows a bloodied bathroom that has a laundry washer. The washer has a bloodied axe and an organ. There is a walk-in shower with white curtains that are covered in blood stains. The bathroom is made of white tiles that are covered in bloodied hand prints and the text RUN on top the bathroom tiles there is a framed rectangular picture of a speed boat. There are red towels on the floor and next to the sink. The sink has a mirror cabinet that has blood stains. The white porcelain sink has more blood going down the drain. There is a black box on the floor, next to the box there is a heater. The toilet is white but has some blood covered and the seat is closed."
6,"This scene is of a bird housing shed. The shed is made of cedar wood planks, there is a large window and an open door entrance. There is a wooden white shelf on one of the walls. The shelves had some toys and slits in them. On the floor there is a yellow bucket, a stool and wooden square planks on the corner. The floor has a silver feeding trout. The birds are sitting on wooden triangles mounted on the wall. They fly down and eat from the feeding trout. They pick at it for a bit and fly back up"
7,"The room is small, painted in a light yellow colour with thick cable wires mounted to the tops of the walls lining the room and ceiling, the wires are held together by small metal pieces. The wall has a corded phone hung, there is a small black box that has a button to open a door adjacent to the button. Across from this wall, there is a rectangular light mounted on the wall. On this second wall there is another large metal door. The door slowly opens and a man in a hazmat suite enters the room. The door closes behind him. He walks to the second door and presses the button to open the door. He takes a step back and waits for the door to open"
8,"This scene shows a hilly forest with a trail going down a hill leading to a windy pathway. The trees are dead, and a lot of leaves cover the floor. There are patches of snow on the ground, the forest has indented ground patches and the snow covers these areas. The sky is sunny. The wind blows against the branches of the dead trees."
9,"There is a busy fire station, with large red bay doors. The station has four doors, two of them are closed while the other two are open. Two vehicles are reversing into the bay doors. One of them is a smaller ambulance that is red with a bright yellow strip. The other is a large red fire truck with silver side sliding doors and a hose at the back of the truck. Their reverse lights are blinking as they slowly back up into the station. Next to the station there is a neighbourhood of condos. The neighborhood is quiet with no driving cars or people. The pavement is wet, the leaves fell off the trees and the sky is gloomy."
10,"This scene is a soccer field busy with people playing and watching the game. A few of them are sitting on chairs watching while most stand around. Some are sitting far on the wired fence that is surrounding the field. The field is a bit patchy. There are two teams playing, an orange team and yellow team wearing coloured pinnies. The ball is kicked in the air from a distant player and players from the teams rush to grab the ball, two players run into each other and one fouls the other. The ref blows his whistle, the player in yellow helps the orange player on the floor and pats his shoulder. The injured players get up and rejoin the match. The ball is brought back and another player does a free kick."
11,"The scene is looking at a small town from a building with metal scaffolding, there is a green mesh surrounding the scaffolding. The building diminished. The town is made up of houses with large pointy triangular roofs, in the center of the town there is a large building with a lawn surrounding the building, this building has white and black metal and stone fencing, there are some large trees planted and there is a drive way that is open leading to the house. Next to this house there are a lot of other houses with similar designs. The road is clear and one car is parked there. "
12,(missing)
13,"A lady is spray painting the side of a building. The building looks abandoned with broken glass and vines growing on the side of the building. There is a lot of garbage next to the building like loose cement bricks, white bucket squares filled with grass, tires and other small items. Behind one of the large white squares on the ground there is a man wearing a black hoodie looking around. The lady is painting over a white gerifiti mark, the gerifiti is on a silver large door of the building. She moves her body around and takes a second and stops looking at the paint job as she continues to spray the paint."
14,"This scene is a long tunnel, it has a narrow comment pathway big enough for a bike to go down. On the edges there is a small sidewalk on both sides of the path, there is a yellow paint trip separating the sidewalk from the bike path. The tunnel is well lit with walls made of half tile and metal heaters attached to the wall. There are vents mounted on the wall. A man drives down the pathway on his bike, the bike has one light on. Behind there are two people walking. The tiles are coloured white, there is a blue strip of pain at the top half of the tiles, and orange paint on the ceiling."
15,"This scene is a dance hall, in the center there is a dance group, performing hip-hop dance moves as a group. They wear matching outfits and perform in a large open room, there is a large crowd of people sitting down watching them. The stage and dance area is lit with flashing disco lights and blue and pink lights. There is a stage area with a large LED sign that says hull. The crowd is cheering and some are clapping for the dancers."
16,"This scene is an underpass tunnel area that is dark which leads to an open field with trees and bushes. The sun has set and there is little light in the sky. A man is riding his bike down this path, a lady passes him but a man rushes at her from the dark shadows of the underpass and he takes her. The lady attempts to resist and screams but the man drags her into the corner."
17,"There is a trail that comes from an open field, and leads to an area that is covered by tall dead trees, the floor is covered in leaves but the pathway is clear. A man near the bushes and trees wearing a black outfit puts on an anonymous mask and hides behind the tree as he crouches down. A lady running down the path encounters the man, he grabs her. The lady screams and tries to resist but the man drags her behind the tree trunk. The lady is wearing a green athletic shirt and black pants"
18,"This scene shows a busy go-kart racing track, the track is lined by a black and green curb that outlines the tracks. The track ceiling is made of a metal ceiling with exposed metal bars and large patches of glass on the ceiling bringing in light. There are drivers going fast on the track, wearing helmets and driving different coloured go karts."
19,"We are shown a room with large vaults that have silver handles and magnets on them. On these large doors there are multiple papers and signs hanging on the wall. The room has yellow tiles. There is a large silver transport cart on the side, some storage containers, a sink area with white cupboards and a blue garbage bin next to it. A woman enters the room wearing scrubs, and gloves, she opens one of the vaults and removes a body tray, there is a body covered in white paper on the silver tray. She leaves the door open and the door is helped open by the tray, she leaves the room after this."
20,"This scene shows the entrance of a hospital where multiple paramedics are walking in throug the sliding automatic doors. An ambulance light flashes in the distance and we can hear some noise. The paramedics walking and in between is a person lying down on a stretcher, the man is strapped in the stretcher with multiple belts going across his body and he has a lot of medical items on him. Some of the paramedics are wearing black uniforms while others are wearing yellow and red, some of them carry ipads while the others help push the patient and others carry charts that dangle down. They walk together and a lady in front of the group opens the door and they all enter the room as the glass slide doors open."
21,"This scene is in a physician hospital room, a doctor sits in front of a patient using medical equipment to look at his eyes, the patient is sitting on a black chair, next to him is a red chair and a lime green desk with some medical equipment on top and next to the desk. The room has a hospital bed, some yellow coloured cabinets and drawers on one side and the door into the room is open with the number 14 printed on the door in orange. The doctor is wearing a white lab coat while the patient is wearing a black shirt and dark coloured pants."
22,"A woman is standing in front of the entrance of a hospital, she is wearing all white and is digging through a bag that she carries on her arm. She puts her bag on her shoulder as she walks around the entrance, she is coughing and she is hunching down after every cough. The hospital entrance is not busy, with her only standing there. The doors to the hospital are clear see through glass with a red line strip going through the middle laterally. There are two blue garbage bins in front of the doors. The lady walks towards a small shelter next to the doors behind a wall."
24,"This scene is of an eastern european church made of old stone, the paint is chipping and the windows of the building are carved in. Next to this white building there are multiple housing complexes, some are coloured yellow, beige, red. All the buildings are designed in an easter european  style. In front of these buildings there is a large and open road made of small square stones. On this road some people are walking casually, a bike is parked next to the church. "
25,"A lady dances inside an empty dance studio, she's standing on her hands and moving her legs in a wave like motion upside down. The dance studio has some silver poles around the room. The floors are made of grey wood, on the wall there are purple silhouettes of people dancing painted on the wall. There are mirrors mounted on the wall with purple LED lights on the floor. There is a small window at the top of the wall. One wall has three children silhouettes painted, the other silhouette is on the adjacent wall with one woman dancing.There is music playing and the woman is dancing and ends up landing on her knees to finish the dance."
26,"Two horses are behind a small wooden fence, one horse is all white and the other is golden brown with a white strip on its head. The horses are looking around, some are picking at the floor. The stable is made of two houses, one connected to the fenced horse area and another white building is connected to the stable house. The grass is covered in dead leaves, next the fence there is a small muddy trail, on one side there are some wires and random items lying on the ground. The trees are skinny and dead. "
27,"This scene shows the end of a water slide. The water slide is orange and leads to a room made of white tiles with floor vents and a silver railing next to the exit of the waterslide. On one side of the slide there are small water floats stored. People calm down the rushing waterslide, some of them are making sounds of excitement, they exit the slide and hurley move to the door next to the slide. There are two people who are riding singular red and yellow floaties while a couple comes down riding a blue double floatie."
28,"There are men dancing on a stage wearing white tank tops and tight jeans with timberland boots. They are dancing in sync to loud music, they rip their shirts and dance, they are doing tricks and jumping over each other, they swing their shirts around the side fast and hold it above their head and stop to pose. The stage is coloured with pink, blue and red lights. THere are multiple people watching in the crowd and they cheer for the performance."
29,"Multiple people are on a hill overseeing a city in the distance. Some are sitting down on a leather brown couch, others are sitting on the ground. Some are sitting in black metal chairs while others are standing around. Some of them are smoking and others have drinks in their hands. They are swinging their bodies to music. The people are wearing jackets and layers of clothes, the sky is a bit cloudy and the trees close to the people are leaves. The area is busy, with multiple people crowded in the same area, some people are hugging each other. "
30,"This scene is of a mansion that is painted white, it has a canopy patio and balcony, the roof has a decorative trim, and the building has large windows. The front of the building there is a large open driveway where some people walk by. There is a statue on a pedestal, and next to it there is a bench. The area around the house is well landscaped, with bushes cut  well. More benches line the side. Some people walk by the front of the house. "
31,"A zookeeper feeds animals, she has a bucket of food and a pack of animals follow her around. The area she is feeding them in has broken tree stumps and tall and skinny trees surrounding the area. The ground is covered in leaves. The animals peck at the floor to eat the food. There is a signage area with a small roof and shelter area, it holds clear glass."
32,"A zookeeper feeds animals, she has a bucket of food and a pack of animals follow her around. The area she is feeding them in has broken tree stumps and tall and skinny trees surrounding the area. The ground is covered in leaves. The animals peck at the floor to eat the food. There is a signage area with a small roof and shelter area, it holds clear glass."
33,"There is an overpass that goes over a busy road with cars speeding below. The overpass has red railings and a lady is leaning against the railing watching the cars pass by. There is a small road on the bridge overpass, and a car passes by. There are trees lining the road, they are coloured in green, yellow and orange."
34,"The walls are covered with wall climbing steps and grips, the walls are shaped in unique ways with some wrapping around the room and protruding out. The walls are painted in green and white with the grips and handles being coloured in multiple colours like blue green grey and white. A few people are climbing the walls, some are resting on the floor. There are 5 people in this room. One person is sitting by themselves on the floor, later a woman comes to join them, they sit together for a while. The person sitting down is wearing black sweater, the girl is wearing a green and white shirt. The person wearing the black shirt that was originally sitting down alone gets up and walks towards the wall. On the right a man in a green shirt is climbing the wall."
35,"This scene shows a Volkswagen car showroom, there are multiple cars placed around the room, each car has a white pedestal with a written description, the cars vary in colour and shapes. The room is large and well lit. It had an exposed ceiling showing the pipes and the metal holding the room. There is a large glass roof, with metal parts in between the glass. The ceiling structure is painted in white, there is a van hanging from the ceiling. The showroom is empty with no people present. The weather outside is bright, letting in a lot of light into the showroom."
36,"This scene shows a roulette table with no one playing the game. Many people are having side conversations at tables close to the walls. Some are standing while others are sitting at tables. At a distance, there are more people, loud music is playing and there is a disco ball with lights flashing. There is a stairwell behind the roulette table. The place is busy with multiple people walking around. The people are wearing formal clothing. The walls are lit with ink and blue LED lights."
37,"This is a dance hall, with a stage and multiple people watching and listening to the man on the stage. The people are standing and jumping to the rhythm of the music, the man on the microphone is shouting out dancing instructions and laughing. There are many people jumping rhythmically and some are shouting. The hall has flashing red and blue lights, there is a large blue crystal chandelier on the roof. The stage is surrounded by red curtains and red lights. A man moves around the stage taking pictures, he later comes on the stage to take more. The people are dressed in formal wear, many wearing suits and long dresses. The song dies down and people stop dancing."
38,"A man is sitting in a dark cave with small candles lit all around him, he has a hoodie over his head with the strings drawn so that only his eyes and nose can be seen. The hoodie is black. He shines a cellphone flashlight beneath his face. The rock above his head has white words spray painted."
39,"This scene is a tattoo shop, a lady is lying down on a bed with her leg exposed as another man is tattooing her calf. The lady is lying down on her back with her arm below her neck as she is looking at where the man is tattooing. In the shop there are other beds to the corner, and fans and bags on the floor. The walls are painted half with a dark purple paint and the other half being white tiles. The floor is made of cement, the wall next to the tattooed man is mounted with equipment behind plastic covers, they are organized in neat squares and labeled."
40,"This scene is an orange cart on an amusement ferris wheel. The cart is moving backwards slowly, as the cart moves, we see the other cart across from it moving. The ferris wheel is made of white metal, and it's placed inside a loud and busy amusement park with loud alarms ringing and children screaming. The view shows multiple trailer cars parked, an open green field and smaller cars on one side of the park, and on the other side we see other rides and small houses with solar panels on the roof. People are walking in the park, the other rides are colorful and some have bright colourful lights flashing. "
41,"This scene shows a busy to-go food restaurant countertable. There are see-through glass casings displaying various types of food on dishes, there are two countertops separated by an entry into form behind the counter. One counter has blue LEDs flashing and outlining the food display, behind this counter is a man who is giving food to people on the other side of the counter. The area behind the counter is busy with people getting food ready, the workers wear orange shirts and move rushly preparing food. A man standing in front of the counter grabs an item and walks out of the restaurant. In front of the counters there is a fridge with pop drinks. The restaurant is busy with people coming and existing and some waiting for their food. In addition to the one that grabs his food, one man orders and steps back, and two people enter the restaurant. The food place has a designed roof with black pebbles and blue LEDs. The floor has a black and white tile pattern, and a red carpet lines the area in front of the counter and leads to the exist and entrance"
42,"This is the lobby of a movie theater that is well lit, there is a circular desk with white LEDs and a black strip making a strip pattern. The lobby is busy with signs of movies placed on the floor, decorative trees on one side, and a box cutout of a 3D city on one side, on one end of the lobby there are large signs of movie posters, The lobby has a few people walking around, some are sitting on benches attached to the wall waiting. THis movie lobby has a second level with a stairwell on one side, leading to a balcony that's lined with small square papers. There are people giving each other hugs, a family of three walking together. A person going up the stairwell and people checking in at the desk in the lobby. "
43,"THis scene shows a large dog house, with piles of hay spread around the floor, there are some stacks of hay on the sides. A bed that is unmade with a white bedsheet, the room has an exposed ceiling with plywood and wooden studs lining the ceiling. There are toys and tunnel running toys placed all over the area, there is a small castle tent with a blue towel inside it. Behind this castle toy tent there is a small table with a bright yellow table cloth. Across from the table there is a small room, the room is separated by a wall with large open slits and an open doorway. There are small tiny dogs playing and moving around the area, they wag their tails. Some of the dogs are lying on the bed. "
44,"This scene shows a dark path that's lit by one street light. The path is surrounded by trees and bushes. The path is empty, and it leads to a lit area. Lining the pathway is a small concrete railing. The sky is pitch black, and only the side street lights lit up the path"
45,"In this scene there is an empty room with empty chairs that have a small cloth hanging on them. Rectangular windows line the walls, on one side there are shelves mounted to walls with small cedar trees decorated on the shelves. There is an aisle run away splitting the chair sections in half, the aisle leads to a stage area, with a podium on one side. Behind the podium there is a casket decorated with flowers and candles standing on silver pegs. Next to the candles there are green pushes also standing on silver pegs. The casket area is well lit, the casket is cedar brown, and there is a large red square painted on the wall behind the casket."
46,"There is a church hall with its lights dimmed and multiple people sitting on benches holding a small paper as they watch a choir group sing, they are being conducted by a man standing on a pedestal. The choir singers are standing on the stairs in ascending order, they are wearing white while there are instrument players with black suits sitting on chairs on the floor. The conductor has his hand around, the band goes from singing in a low tone to getting louder gradually. The church has large carved arches and pullers."
47,"There are multiple people in a surgery room, they wear sterile blue gowns, hair covers, masks and long cloves. The room is spacious, surrounded by medical equipment, some are on wheels and put to the side while others are close to the physicians. There is a TV on a medical cart to the wall, there is a long wire on the floor plugged into the wall. The physicians are clumped together, two of them are standing on one side of the table passing equipment to the surgeon that they grab from a small table with a blue sterile table cover on top of it and hanging. To the far side there are two people wearing green scrubs. There is peeping and people conversing."
48,"This scene is the inside of a shopping store, with shelves stocked with varying items of multiple colours. The shelves are neatly organized with some areas shopped well and half empty. There are some bins lining the aisle. A lady with a handbasket on her arm looks at the shelves, grabs an item, examines and reads it then puts it in her basket and turns away from the shelf. The store is well lit, with signs on the wall aisle. The floor is clean and white, the store isnt busy."
49,"This scene shows an open park with neatly cut grass and well landscaped trees, the grass is bright and clean, there is a side walk and trail that goes alongside this open area. There are cars parked on the other side of this park, the skyline is full of tall buildings and skyscrapers. The road is busy with cars going by. Some people are walking on the sidewalk. The sidewalk next to the road is coloured in a brownish red, while the pathways that enter the park area are coloured in grey."
50,"There are multiple people in black uniforms and bullet proof vests, ski masks and pistols standing in a hallway in front of a door that's open. A loud noise is heard and a scream follows, the door gets slammed shut and the people in uniform withdraw and pull their guns out pointing it at the doorway. Some take cover and hide near the stairwell while they have their guns pointed facing the door. Next to the room, there is a stairwell that has glass doors with black frames. Besides these glass doors is a man wearing a blue and white vest, leaning against the wall casually with his hands behind his back, he is wearing a black ski mask. The people in the black uniform are shouting as they move back from the door slowly."
51,"There is a gun range that is covered in white panels with silver metal stripes making a pattern of rectangles. In the gun range there is a woman with yellow soundprove headphones, she has a pistol and is shooting downrange at a green screen. Next to her is a man wearing a black shirt and khaki chinos, the woman is wearing a grey sweater and black pants. In front of the man is a small desk with some items on it. Behind both of them is a man standing, with a green shirt and blue jeans. "
