narration_id,narration_text
65,"There is a large room that has white roofing, walls and dark grey tiled flooring. There are many cages in the room, most are empty but there are some with cats that are meowing. The cages with the cats have litters inside. The cats are white and black. To the other side of the room there are white cabinets over a sink area and beyond that is a white shelf."
66,"There is a large room that has white roofing, walls and dark grey tiled flooring. There are many cages in the room, most are empty but there are some with cats that are meowing. The cages with the cats have litters inside. The cats are white and black. To the other side of the room there are white cabinets over a sink area and beyond that is a white shelf."
67,Chickens graze a field in a fenced area. the fence is not of wood but a thinner matieral. The chickens are mostly brown and are walking around during the video. Some start to jump around towards the end. The day has quite a bit of overcast and the grass is very green. There is a building with a big poster on it that says Freiland-Eier with pictures of white chickens and eggs on it.
68,"People are going about their lives at a city square. Some people are standing around, others sitting in various places talking, others are walking around. The day is sunny with little overcast. There is one lady with a black backpack, grey top, blue jeans and pink shoes who is posing for a photo. The city square has many digitalized buildboards dispaying various ads. "
69,"A person with a bald head wearing a grey polo/dress shirt, black pants and black shoes is giving a haicut to another person sitting in a chair with a white cloth wrapped over them. The place they are in is well lit and has other areas for cutting hair with mirrors in front of the chairs. The chairs are grey and the colour scheme of the shop is grey and white. There are other chairs that are not for cutting hair but washing it. The only people in the shop are the two mentioned before."
70,"Two people are in the back of a paramedic van. One is unconscious and is attached to various machinery. They are wrapped in a brown blanket. The other person is sitting at their head and taking notes while periodically looking up. They are wearing a light grey top, a blue mask and blue surgical gloves. The back of the van is white with some orange here and there. There is also a security camera in the back of the van."
71,There are many young pigs seperated in their pens/closed off areas. The pens are green with a large feeder within it. The rest of the area is white except the flooring which is brown. The pigs are rushing to either feed or are running around their pens. The pigs are light pink and small in size compared to a full sized pig. The area is well lit with tube lights.
72,Two people are playing mini golf in a glow in the dark facility. The area is dimly lit with purple lights at the top. The clothes of the people playing are not discernable because of the lighting. The ground looks blue in the light. The walls look green in the lighting. There are theme of the place is something resembling the antarctic or the northwest territories in Canada. It is supposed to be very cold with snow on the ground and paintings of people on the wall in kayaks dressed very warm. there is also a statue of a polar bear and various structures similar to what you would find in that climate.
73,"A person in a long sleeve dark top and lighter pants is at a shooting range firing a gun in one of the designated areas. they are also wearing a cap with earmuffs. The person periodically shoots the rifle instead of repeatedly in a quick fashion. The person is sitting down while leaning the rifle on the table and shooting. There are barriers on either side of him and then another seat where other people can shoot. There is a seperate area to one side of him that is seperated by an entrance followed by a door. The other side of him is a white wall. The ground is a dark grey and well lit, the walls are white."
74,"There is a grey stone tiled walkway with a street in the middle. The people are walking sitting and others are waiting for busses. The street is facing a large building that has architecture similar to a parliament building. The busses are large red, double decked busses. One is on either side of the road going in opposite directions."
75,"There is a grey stone tiled walkway with a street in the middle. The people are walking sitting and others are waiting for busses. The street is facing a large building that has architecture similar to a parliament building. The busses are large red, double decked busses. One is on either side of the road going in opposite directions."
76,There is a small room with minmal furniture. The room is largely white except for some of the furniture and the floor. The floor is grey. There is a light brown desk and light brown chair at the desk. There is a cabinet that is also light brown. There is a small bed with just a bedsheet that is white and light grey stripped. The last bit of furniture is a metal toilet connected to a sink.
77,"There is a large open area, mostly open field. There is a large building with a large area that is pavement leading to a landing pad where a yellow helicopter is starting to land. The helicopter intitally starts far but gets closer and lower as the video goes on. The day is sunny but has some overcast. "
78,"Three people are inside a largely white bedroom laughing together. The room has a white roof and walls, one wall is slanted downwards as if its a part of the room and has a window in it. The floor is wooden and brown. The people are laughing together, one of them is wearing white and black pants and a shit and is standing slightly farther and leaning against the wall at times. The other two stand closer together and one is wearing a red shirt and blue zipup with black pants, the other is in a grey shirt and black pants. The people standing closer together are standing on a red carpet. "
1,"Public washroom is silent. There is no one inside. There is one toilet and a bin. The walls are made of white rectangular tiles and a blue stripe along the perimeter of the wall, on the even level. It is clean inside and bright."
2,"Inside of a mechanical room with a lot of technical appliances. It is tan colored. There are a lot of black knobs, gages with red arrows. There is a big pipe on the celling and a helm connected to it. On the left side of the room there are stairs with three steps that lead to another room."
3,"Inside a restaurant. Multiple chairs stand across the room, orange and grey colored. The tables are white, simple, and there are no people inside. Tables have napkins on them. The room is bright with big floor-length glass windows. Over some tables, there are chandeliers of simple design, black and circular."
4,"Inside the apartment bedroom, that it is white and spacious. A man sits on a bed, he is looking at his phone. He places it on the nightstand shortly after and gets up from the bed. He moves towards the other table and grabs a remote from the TV. He returns to the bed and turns on the TV."
5,"Inside of the bathroom with a shower, washing machine, toilet, and a sink. The white tiles of the walls are covered in blood. There are marks of hands on the toilet cover, walls, and the curtain of the shower. There is an axe lying on top of the washing machine next to the toilet, it is covered with red blood, it made a small puddle. Over the toilet, there is a sign painted by blood that says ""RUN"". There are no people inside. "
6,"Pigeonry with 7 pigeons. It is made out of wood and has some rectangular shelves inside for the birds. There are two windows, one of which is smaller. The floor is filled with a thin layer of sand, there are also a few wooden plaques laying around. Pigeons are flying up and down near the same wall. They are calm."
7,A corridor with light yellow walls. There is a lamp on the wall. A sturdy door slowly opens and we see a man in a yellow head to toe costume. He is wearing a gas mask and black gloves. The door slowly closes when he is already inside. He comes up to the wall with a phone on it. He touches it and starts to dial in some numbers. This while time the light of the lamp slowly flashes.
8,A nature scene. Bright blue sky in the winter with some hills and trees. Trees do not have any leaves anymore. The wind blows and the branches slowly rock.
9,"Outside of the fire department station. There are two trucks going inside of the red building. The sides of the truck display a number ""112"". Both of the trucks are red."
10,"It is a football match on the grass field. The weather is cold, and people who watch the match are wearing jackets. They stand near the pitch. One man sits on a chair, watching the practice. The players are wearing orange and yellow uniforms. The player with number five in an orange t-shirt standswith  the ball and gives a pass to his teammate. They continue to play."
11,"A cityscape of a small town somewhere in Britain. The camera is positioned on top of the old building, that is being renovated and has scaffolding on the two peaks. The weather is windy and cloudy, one white car passes down the road. The private houses are mostly brown and white. The trees have a little bit of green on them. "
12,"An abandoned old building with grey garage doors. A woman paints graffiti in a bubble style on them. The windows are cracked and after she finishes, she steps back."
13,Somewhere underground in a tunnel with a dimmed lighting. It is empty except for a man on a bike that rides it slowly.
14,"The scene is set inside of the concert hall. There is a large dance floor, and dancers are in the center. They are performing in the centre while strobe lights shine in the background. Lights are purple and blue. A big crowd around the dancers is cheering and watching them."
15,"The scene is set inside of a tunnel, where a dark evening is seen. A cyclist goes inside of the tunnel. After that, a woman running from the other side appears. She is attacked by a man who drags her to the side. They dissapear in the dark."
16,"A man approaches the camera, putting on an anonymous mask. Then he proceeds to hide behind a tree next to him. He waits while a woman in a green shirt, who is running, passes him. He drags her by the waist, while she struggles to break free. They struggle and fight, but he makes it to the tree where he was hiding with her."
17,"Inside of a carting treck, cars are going around in circles. There are 8 drivers, who drive slowly, without bumping in anything."
18,"Inside a morgue room, which looks very clean with white tires on the floor and warm lights. There are 3 refrigerators. A blonde woman in blue scrubs comes in through the door. She opens one of the fridges and pulls the tray with a body in a white bag halfway. It stays in that position. Then she goes away, leaving the tray out and the fridge open."
19,"Inside of an entrance to the hospital. A group of paramedics in red and green warm suits comes in. They walk through the sliding door slowly. They have a patient lying on a rolling table, covered in blue blankets. The group of people continues to walk in to the next sliding door. They dissapear after that."
20,"Inside of an optometrist's office, there is a doctor examining a patient's eyesight on a special machine. They sit in a corner of the office, next to the doctor's computer. The doctor is wearing a white coat, the patient is in a long-sleeve sweater. The door to the room is open to the inside, and the room's number is 14. "
21,"Inside the hospital's corridor. The walls are painted white, and there are some medical devices along the walls. The doors to one of the exam rooms is open and we see a nurse there. There is also two women passing by, a nurse who brings a woman to the exam room. The nurse, who is wearing a red jacket over her uniform, goes away once the patient is inside. Meanwhile, the patient flicks the light switch."
22,"Outside of the hospital entrance, in the evening, a woman wearing white coat tries to put on her backpack. She struggles a lot because of the weight and her posture slouches once it is on her shoulders. She goes away."
24,"On a square in a European city, there is a catholic church. It is white and located in old part of the town, with cobalt road. A woman passes by towards the small houses, which are yellow. Except for her, it is empty."
25,"Inside of a dance studio, there are poles for dancing. There is a woman, standing on her arms upside down, she moves her legs slowly in a wave-like pattern. She gets down on her knees and continues to dance with her arms, sitting down. She performs a split and gets up."
26,Two different horses on a farm are standing near the fence. They are calm and looking around. One of the horses moves their head down to graze some grass. The weather is cloudy and gloomy.
27,"The bottom of the aquapark slide. Some finish their slide down and try to get up with their tubing. They come out of the water in pairs, one by one."
28,5 men are dancing in front of a large crowd. Strobing lights flash and the men rip their white tanks off their chest. They start spinning their shirts as if they are about to throw it in the audience and point to people in the public. The dancers stop and continue to hold it above their chest.
29,"A large number of people sit on top of the hill. They watch the sunset. People are in small groups chatting, hugging, and looking at the view."
30,"An outside of a big old white house. There are palms in the court, the sun shines brightly and there are a lot of trees outside. There are some people exiting the house moving outside."
31,"The scene is set in a park, on a bright day. A woman comes into frame and there are a few grey foxes following her. She stops near a fallen branch and starts feeding the animals. They come in a circle and follow the food."
32,(missing)
33,"There is a busy highway, and the camera is set on top of a crossing bridge for pedestrians. There are a lot of cars going in different direction. The bridge is red, and the highway is surrounded by trees."
34,"Inside of a climbing centre, one boulder tries to climb up a wall with an incline. He places his legs carefully. There are other people as well on the other wall. Two people also observe sitting further from the wall on the matt."
35,Car dealership. There are a lot of cars from volkswagen. They are shiny and stand far apart from each other. 
36,"It is inside a dark ballroom. Many people are going around, dressed in official tuxes and floor-length dresses. The ceiling is bright pink, with some blue accents. The light wooden parquet floor reflects the lights. Further in the room, there are more people in small groups. Close to the observer, there is a roulette that spins, while the croupier collects the chips and moves away, walking to the other side of the room."
37,"Inside a concert hall, there is a performer on the stage with a microphone, dancing in front of a large crowd. The audience is dressed officially, and they mimic the moves of a man on the stage. People jump and wiggle their feet in rhythm. Disco lights strobe and play around. There is also another man who comes on stage at the end from the audience. He walks straight to the performer and takes the microphone from him."
38,"There is an empty black scene. There are some dots of light far away and a man stands with a flashlight directed on his face from upside down. Above him, there is a big blob of yellow color and some signs inside that resemble letters, but the resolution is not that good."
39,"Tattoo office with a man tattooing a woman's ankle. It is spacious, with another table in a corner. A tattoo master picks up a machine and moves closer to the leg, leaning in to get a closer look. The client lies there on her back, looking down to see what is going on. "
40,"Inside of a cabin of a Ferris wheel. It has bright red railings and is circular in shape. The wheel slowly spins and we can see the surroundings down on the ground with multiple cars parked and trailers. It is sunset time. We see some people walking on the ground to the merry-go-round, which shines brightly."
41,"Middle Eastern restaurant with display cabinets and some food in them. A customer walks in and picks up their food. At the same time, there is a woman who is still looking. Close to the entrance, there are clear fridges with drinks in them. Employees are cleaning the open kitchen and preparing a kebab with meat that spins on a stick."
42,"Movie theatre entrance with multiple posters of new films. In the centre, there is a check-out with a cashier talking to the customers. People are walking to the doors of the cinema halls. In the corner, people are walking up and down the stairs."
43,"Inside of the room with hay and mats on the floor. 8 dark puppies are inside the room. 3 of them are playing with each other, biting and sniffing. Other puppies are asleep under the warming lamps."
44,Inside a dark tunnel at night. The walls are made of stone. There is one pipe going along it closer to the floor. There is only one lamp that shines on the side.
45,"Inside of a church with a few rows of chairs. It is bright inside. Near the lectern, there is a coffin with a big pile of white flowers on top of it. There is no one inside. There is a cross on the wall, and windows have some mosaic on them."
46,"Inside of an old catholic church, there is an orchestra giving a performance. The dirigent faces the audience with his back, meanwhile the audience is sitting on the bench. The orchestra plays following the gestures."
47,"Surgeons are performing a procedure inside the operating room. It is really bright inside with multiple sources of light. They are wearing blue costumes, while around one table in the centre. "
48,"Inside the supermarket, there are aisles of canned goods. A woman wearing a green coat comes to the boxes with tea and stands there for some time. She picks up one and places it in her basket and goes away."
49,"Outside, in the park somewhere in the city. The point of view is on the green grass, overlooking some tall office buildings. There are some cars parked outside of the park."
50,"Inside the building corridor, there are armed men in black bulletproof vests and masks. They retreat to the back and point the gun at the end of the corridor. There is also another person standing against the wall, wearing blue vest. They do not take part in the whole action."
51,"Inside the shooting range, there are two men and one woman who shoots in the target. All of them wear earmuffs. One man helps her to reload the gun, while the other stands there in the back."
52,"Winter day in the countryside, ground covered in snow. Sun is really bright, and there are trees growing in one straight line "
53,"A lot of people are sitting on the rocks. They mostly sit in pairs. Behind them there is a park with trees, and a city skyline."
54,"Inside the studio, we see a drummer practicing on his set. There are multiple drums in the other corners of the room."
55,"The gun shop. There is a man in a cap who is polishing his gun, looking at it, and assembling. There are rows of riffles behind him, on display. "
56,"During a fitness practice in the gym, there are 5 women with a barbell on their shoulders, performing squats. The gym is bright inside, with one big circular light source in the centre. After squats, they start doing Bulgarian split squats with the same barbell."
57,"There is a large living room, and a big blue couch sits in the center, where a woman is seated. Near her, there is a baby on a pillow. She feeds the baby from a bottle. We see a dining table behind them. "
58,"A panoramic view. There is a big white ledge made out of concrete and tiles. In the left corner, there is a tower with four columns. It is brown. "
59,"Train station, while one train departs. People leave with suitcases rolling behind them. It is sunny and bright outside. In the centre, there is a staircase that leads underground, and some people go there. At the end, a man is passing by with a trolley."
60,"Dark bathroom with candles. One candle is on top of a sink, twinkling in the wind. The other is next to it."
61,"Outside in winter, there is a person shoveling snow from their car. It is a street with houses 2-3 stories. There are a lot of other cars along the street as well"
62,There is a corridor that resembles a prison cell with barrs in each room. Inside of a small room there is a dog who plays with the rug on the floor. It wiggles it's tail.
63,"It is a beach in the morning, with the sun high up in the sky. The sea is light blue, with the waves along the shore. The sand is white. There are some people closer to the water. There are also beach houses further behind the fence that divides the beach from the grass."
64,"A person is playing the piano, next to the open window with a view of the city. It is dark outside, and the houses have light in their windows. There is another piano as well, put nobody plays it. "
65,"It is a veterinary office with white tiles on the walls. There are kittens inside the small units, going around from side to side. The cats are white with black marks on them. To the right, there are two sinks and kitchen-like cabinets at top. One cat tries to escape its little chamber, so it climbs up the wall inside it."
66,"It is a veterinary office with white tiles on the walls. There are kittens inside the small units, going around from side to side. The cats are white with black marks on them. To the right, there are two sinks and kitchen-like cabinets at top. One cat tries to escape its little chamber, so it climbs up the wall inside it."
67,"In the countryside of the chicken farm. Multiple hens are going around in the grassfield. Behind them there is a barn with a poster that says Freeland. Chickens go around, flying and tasting the grass. The weather is cloudy and the trees behind do not have any leaves on them."
68,"Busy square in the city. There are advertisements on the glass buildings. There is a woman in the centre, she tries to take a picture. She does a pose of her hands up in the air, and the photographer suggests her to try another angle. She goes to the other corner. Meanwhile, a lot of people cross the street, cars go around."
69,"Barber's office. One man does a haircut on the other. He trims his hair. There are only two of them in the shop, but there are multiple empty chairs."
70,The ambulance car. There is a patient and a nurse checking his vitals on the screen. The patient is covered with blankets and has an oxygen mask on his face. She writes something down on the paper. 
71,Inside of the pig farm. There are many small pigs running around and feeding from separate containers filled with food. The containers have blue lids. Each enclosure consists of a small green fence.
72,"Inside of a museum exhibition. The exhibition is dark to resemble a night with a bright northern light picture. There are figures of animals such as bears, moose, and fish. There are also figures of people dressed in fur, covered head to toe. There is also one real human who stands and looks at one part of an exhibition with a wolf in it. "
73,"There is a person inside a shooting range, sitting and aiming at the target with a gun. He is wearing headphones and glasses. The shooting range has three seats and is not very big. Behind a man, there is a wall with a fire extinguisher and a table. "
74,"In a city. A double-decker bus of red color comes to a stop and picks up people. Behind a bus, on a square, there is a big white building in a classical style. On the right side of the bus stop, there is a fountain. "
75,"In a city. A double-decker bus of red color comes to a stop and picks up people. Behind a bus, on a square, there is a big white building in a classical style. On the right side of the bus stop, there is a fountain."
76,"Inside of a preson cell. There is a bed, a wardrobe and a table with chair and a toilet. On top of the bed there is a small window with the bars on it."
77,In a grass field. There is a landing place for the helicopter. The helicopter slowly approaches the ground. It is yellow. There is a warehouse in the back. There are also yellow tall boxes made out of profiled sheets.
78,Inside of a small bedroom. Three men are laughing really hard. They clap and slap in excitement. One of them leans on the wall.
1,"There is a bathroom, with a silver toilet and made of white tile walls with a blue strip of tiles. There is a white garbage bin that's half full. There are three toilet paper rolls, one roll is hanging out ready to be used. The blue tiles are in a pattern of light blue and dark blue. The entrance for the washroom is a large silver door. The bathroom is clean.  "
2,"The room is covered with gas dials and large spigots on the ceiling, there are wires and cables all over the room. There are gadgets and buttons with black covers on the wall. From top to bottom there are buttons, and handles. There are silver small railings to hold. The floor is painted white and the paint is chipping. There is a small red ramp, and next to that there is a small metal staircase leading to another room. The room is well lit. There is red writing on some of the gas dials, there is a grey and red box on one corner."
3,"This scene shows an empty cafe or restaurant, the chairs are empty, the chairs are coloured in grey and orange and the tables are white with plants and grey dining table covers. There are white pillars around the restaurant area. There are black chandeliers made of four candles hanging from the ceiling. There are green and grey booths on the wall. The room is surrounded by floor to ceiling mirrors, the mirrors are covered by see through curtains and cars pass on the busy road."
